{
  "$schema": "https://json-schema.org/draft/2020-12/schema",
  "type": "array",
  "items": {
    "type": "object",
    "properties": {
      "count": {
        "type": "integer",
        "exclusiveMinimum": 0,
        "maximum": 9007199254740991
      },
      "latitude": {
        "type": "number",
        "minimum": -90,
        "maximum": 90
      },
      "longitude": {
        "type": "number",
        "minimum": -180,
        "maximum": 180
      },
      "municipality": {
        "type": "string"
      },
      "province": {
        "type": "string"
      },
      "id": {
        "type": "string",
        "minLength": 1
      }
    },
    "required": [
      "count",
      "latitude",
      "longitude",
      "municipality",
      "province",
      "id"
    ]
  },
  "$id": "https://www.xedotnet.org/schemas/locations.schema.json",
  "title": "XeDotNet location collection"
}
